{
  "$schema": "https://json-schema.org/draft/2020-12/schema",
  "$id": "https://itool.example/schemas/simulation-execution-result-payload/2.0",
  "title": "Payload de resultado de una ejecución de simulación",
  "type": "object",
  "additionalProperties": false,
  "required": [
    "schema_version",
    "simulation_execution_id",
    "run_id",
    "attempt_id",
    "simulation_key",
    "input",
    "output"
  ],
  "properties": {
    "schema_version": {
      "const": "2.0"
    },
    "simulation_execution_id": {
      "type": "integer",
      "minimum": 1,
      "maximum": 9007199254740991,
      "description": "ID de ejecución asignado por PostgreSQL al insertar; entero positivo representable exactamente en JSON/JavaScript."
    },
    "run_id": {
      "type": "string",
      "format": "uuid"
    },
    "attempt_id": {
      "type": "string",
      "format": "uuid"
    },
    "simulation_key": {
      "type": "string",
      "pattern": "^[a-z][a-z0-9_.-]{0,99}$"
    },
    "input": {
      "type": "object",
      "description": "Copia del input recibido para esta ejecución."
    },
    "output": {
      "description": "Salida específica de la simulación; su schema concreto se definirá para cada simulación."
    }
  }
}
