{
  "schema_version": "2.0",
  "simulation_execution_id": 1,
  "run_id": "b32d7028-0f8c-464a-9d15-a928d292fb0a",
  "attempt_id": "9404fdcc-63e3-4f44-a4a3-480224c590ef",
  "simulation_key": "lri",
  "input": {
    "model_id": "beam-case-042",
    "load_case": "nominal",
    "parameters": {
      "force_kn": 120
    }
  },
  "output": {
    "row_count": 1250,
    "artifact_uri": "s3://itool-results/f0e18f37/normalized.parquet"
  }
}
